{
  "$schema": "https://json-schema.org/draft/2020-12/schema",
  "$id": "https://eip.ensen.dev/schemas/eip.run-status.v1.schema.json",
  "title": "EIP-0005 RunStatusSnapshot v1",
  "description": "Transport-neutral polling snapshot contract for Ensen-compatible async executor runs.",
  "type": "object",
  "additionalProperties": false,
  "required": [
    "schemaVersion",
    "id",
    "requestId",
    "correlationId",
    "status",
    "observedAt"
  ],
  "properties": {
    "schemaVersion": {
      "const": "eip.run-status.v1"
    },
    "id": {
      "$ref": "eip.common.v1.schema.json#/$defs/PrefixedId"
    },
    "requestId": {
      "$ref": "eip.common.v1.schema.json#/$defs/PrefixedId"
    },
    "correlationId": {
      "$ref": "eip.common.v1.schema.json#/$defs/CorrelationId"
    },
    "runId": {
      "$ref": "eip.common.v1.schema.json#/$defs/PrefixedId"
    },
    "status": {
      "$ref": "#/$defs/RunStatus"
    },
    "observedAt": {
      "$ref": "eip.common.v1.schema.json#/$defs/IsoDateTimeUtc"
    },
    "message": {
      "type": "string",
      "minLength": 1,
      "maxLength": 1000
    },
    "progress": {
      "$ref": "#/$defs/RunProgress"
    },
    "extensions": {
      "$ref": "eip.common.v1.schema.json#/$defs/ExtensionMap"
    }
  },
  "$defs": {
    "RunStatus": {
      "type": "string",
      "enum": [
        "accepted",
        "queued",
        "running",
        "cancelling",
        "cancelled",
        "completed",
        "failed",
        "blocked",
        "unknown"
      ]
    },
    "RunProgress": {
      "type": "object",
      "additionalProperties": false,
      "minProperties": 1,
      "properties": {
        "current": {
          "type": "integer",
          "minimum": 0
        },
        "total": {
          "type": "integer",
          "minimum": 1
        },
        "percent": {
          "type": "number",
          "minimum": 0,
          "maximum": 100
        },
        "unit": {
          "type": "string",
          "minLength": 1,
          "maxLength": 80
        }
      }
    }
  }
}
