{
  "schemaVersion": "eip.run-status.v1",
  "id": "sts_01HV9ZX8J2K6T3QW4R5Y7M8N9S",
  "requestId": "req_01HV9ZX8J2K6T3QW4R5Y7M8N9Q",
  "correlationId": "corr_01HV9ZX8J2K6T3QW4R5Y7M8N9R",
  "status": "accepted",
  "observedAt": "2026-04-29T00:00:00Z",
  "message": "Run request accepted by the executor boundary."
}
